{
  "version": 1,
  "source": "src/game/classes.js (CLASSES base literal + CLASS_TAGS)",
  "classes": [
    {
      "id": "warrior",
      "name": "Warrior",
      "role": "Frontline Tank",
      "hook": "Shield Bash stuns enemies. Whirlwind hits all adjacent foes. Unbreakable when outnumbered.",
      "armorType": "Heavy Armor · Sword / Hammer / 2H",
      "primaryAttr": "STR",
      "armorTier": "heavy",
      "weapons": [
        "sword",
        "hammer",
        "sword2h",
        "axe2h"
      ],
      "startingEquipment": [
        "longsword",
        "shield",
        "heavy_chest",
        "heavy_helm",
        "heavy_gauntlets"
      ],
      "skills": [
        "cleave",
        "battle_cry",
        "whirlwind",
        "unbreakable"
      ],
      "svgIcon": "<svg viewBox=\"0 0 36 36\" fill=\"none\" stroke=\"currentColor\" stroke-width=\"1.5\"><path d=\"M18 4L8 14v8l10 10 10-10v-8L18 4z\"/><path d=\"M18 4v28M8 14h20\"/></svg>"
    },
    {
      "id": "fighter",
      "name": "Fighter",
      "role": "Disciplined Duelist",
      "hook": "Riposte counters parries. Tactical stances swap between offense and defense. Precise Strike never misses.",
      "armorType": "Heavy Armor · Sword / Hammer / Shield",
      "primaryAttr": "STR",
      "armorTier": "heavy",
      "weapons": [
        "sword",
        "hammer",
        "sword2h"
      ],
      "startingEquipment": [
        "longsword",
        "shield",
        "medium_chest",
        "heavy_helm",
        "heavy_gauntlets"
      ],
      "skills": [
        "precise_strike",
        "defensive_stance",
        "offensive_stance",
        "riposte",
        "second_wind",
        "sunder_armor"
      ],
      "svgIcon": "<svg viewBox=\"0 0 36 36\" fill=\"none\" stroke=\"currentColor\" stroke-width=\"1.5\"><path d=\"M18 3v26\"/><path d=\"M14 7l4-4 4 4\"/><path d=\"M10 29h16\"/><path d=\"M6 18l6-3 6 3 6-3 6 3\"/></svg>"
    },
    {
      "id": "paladin",
      "name": "Paladin",
      "role": "Holy Warrior",
      "hook": "Holy Strike crits vs demons. Lay on Hands keeps allies alive. Consecration sustains long fights.",
      "armorType": "Medium Armor · Sword / Scepter + Shield",
      "primaryAttr": "STR",
      "armorTier": "medium",
      "weapons": [
        "sword",
        "scepter"
      ],
      "startingEquipment": [
        "scepter",
        "shield",
        "medium_chest",
        "medium_helm"
      ],
      "skills": [
        "holy_strike",
        "lay_on_hands",
        "divine_shield",
        "consecration"
      ],
      "svgIcon": "<svg viewBox=\"0 0 36 36\" fill=\"none\" stroke=\"currentColor\" stroke-width=\"1.5\"><path d=\"M18 3l-14 6v9c0 8 7 14 14 16 7-2 14-8 14-16V9L18 3z\"/><path d=\"M12 18l4 4 8-8\"/></svg>"
    },
    {
      "id": "ranger",
      "name": "Ranger",
      "role": "Precision Ranged",
      "hook": "Aimed Shot ignores armor. Rain of Arrows blankets the entire enemy field for 3 rounds.",
      "armorType": "Light Armor · Bow / Crossbow / Javelin",
      "primaryAttr": "DEX",
      "armorTier": "light",
      "weapons": [
        "bow",
        "crossbow",
        "javelin"
      ],
      "startingEquipment": [
        "shortbow",
        "light_chest",
        "light_boots",
        "ring"
      ],
      "skills": [
        "aimed_shot",
        "multi_shot",
        "smoke_trap",
        "rain_of_arrows"
      ],
      "svgIcon": "<svg viewBox=\"0 0 36 36\" fill=\"none\" stroke=\"currentColor\" stroke-width=\"1.5\"><path d=\"M5 5l26 26M5 5l8 2-2-8\"/><circle cx=\"24\" cy=\"12\" r=\"4\"/></svg>"
    },
    {
      "id": "rogue",
      "name": "Rogue",
      "role": "Burst Assassin",
      "hook": "200% Backstab on stunned targets. Death Mark makes enemies take 50% more damage from all sources.",
      "armorType": "Light Armor · Dagger (dual wield)",
      "primaryAttr": "DEX",
      "armorTier": "light",
      "weapons": [
        "dagger"
      ],
      "startingEquipment": [
        "dagger",
        "dagger",
        "light_chest",
        "light_boots"
      ],
      "skills": [
        "backstab",
        "poison_blade",
        "shadow_step",
        "death_mark"
      ],
      "svgIcon": "<svg viewBox=\"0 0 36 36\" fill=\"none\" stroke=\"currentColor\" stroke-width=\"1.5\"><path d=\"M10 26L26 10M18 10l8-2-2 8\"/><path d=\"M10 26c-2 2-4 2-4 0s0-2 2-4\"/></svg>"
    },
    {
      "id": "cleric",
      "name": "Cleric",
      "role": "Primary Healer",
      "hook": "Mass Resurrection can auto-trigger on wipe. Sanctuary makes an ally temporarily untargetable.",
      "armorType": "Light Armor · Staff / Scepter / Wand",
      "primaryAttr": "INT",
      "armorTier": "light",
      "weapons": [
        "staff",
        "scepter",
        "wand"
      ],
      "startingEquipment": [
        "scepter",
        "shield",
        "medium_chest",
        "medium_helm"
      ],
      "skills": [
        "heal",
        "smite",
        "sanctuary",
        "mass_resurrection"
      ],
      "svgIcon": "<svg viewBox=\"0 0 36 36\" fill=\"none\" stroke=\"currentColor\" stroke-width=\"1.5\"><path d=\"M18 4v28M4 18h28\"/></svg>"
    },
    {
      "id": "bard",
      "name": "Bard",
      "role": "Support Maestro",
      "hook": "Ballad of Valor gives one hero two turns per round. Song of Ruin strips all enemy buffs at once.",
      "armorType": "Light Armor · Dagger / Wand",
      "primaryAttr": "INT",
      "armorTier": "light",
      "weapons": [
        "dagger",
        "wand"
      ],
      "startingEquipment": [
        "quarterstaff",
        "light_chest",
        "silver_amulet"
      ],
      "skills": [
        "inspiring_tune",
        "discordant_wail",
        "ballad_of_valor",
        "song_of_ruin"
      ],
      "svgIcon": "<svg viewBox=\"0 0 36 36\" fill=\"none\" stroke=\"currentColor\" stroke-width=\"1.5\"><path d=\"M8 28c0-3 3-5 8-5s8 2 8 5\"/><path d=\"M14 23V10l12-3v13\"/><circle cx=\"10\" cy=\"28\" r=\"3\"/><circle cx=\"24\" cy=\"25\" r=\"3\"/></svg>"
    },
    {
      "id": "mage",
      "name": "Mage",
      "role": "AoE Glass Cannon",
      "hook": "Fireball torches entire enemy packs. Blizzard hits all enemies for 3 rounds. Arcane Surge: 400% INT.",
      "armorType": "Cloth Armor · Staff / Wand",
      "primaryAttr": "INT",
      "armorTier": "cloth",
      "weapons": [
        "staff",
        "wand"
      ],
      "startingEquipment": [
        "staff",
        "cloth_chest",
        "cloth_helm",
        "ring"
      ],
      "skills": [
        "magic_missile",
        "fireball",
        "blizzard",
        "arcane_surge"
      ],
      "svgIcon": "<svg viewBox=\"0 0 36 36\" fill=\"none\" stroke=\"currentColor\" stroke-width=\"1.5\"><path d=\"M18 4l3 10h10l-8 6 3 10-8-6-8 6 3-10-8-6h10z\"/></svg>"
    },
    {
      "id": "necromancer",
      "name": "Necromancer",
      "role": "Army Builder",
      "hook": "Raise Dead turns corpses into skeleton allies. Death Coil applies Poison AND Bleed to all enemies.",
      "armorType": "Cloth Armor · Staff / Wand / Scepter",
      "primaryAttr": "INT",
      "armorTier": "cloth",
      "weapons": [
        "staff",
        "wand",
        "scepter"
      ],
      "startingEquipment": [
        "staff",
        "cloth_chest",
        "cloth_helm",
        "silver_amulet"
      ],
      "skills": [
        "bone_spike",
        "bone_spear",
        "life_drain",
        "corpse_explosion"
      ],
      "svgIcon": "<svg viewBox=\"0 0 36 36\" fill=\"none\" stroke=\"currentColor\" stroke-width=\"1.5\"><circle cx=\"18\" cy=\"14\" r=\"8\"/><path d=\"M14 14v5M22 14v5M10 28c0-5 4-9 8-9s8 4 8 9\"/></svg>"
    },
    {
      "id": "warlock",
      "name": "Warlock",
      "role": "Chaos Dealer",
      "hook": "Corruption spreads on enemy death. Soul Pact doubles all DoT at cost of own HP.",
      "armorType": "Cloth Armor · Staff / Wand",
      "primaryAttr": "INT",
      "armorTier": "cloth",
      "weapons": [
        "staff",
        "wand"
      ],
      "startingEquipment": [
        "staff",
        "cloth_chest",
        "cloth_helm"
      ],
      "skills": [
        "corruption",
        "hellfire",
        "soul_pact",
        "void_rift"
      ],
      "svgIcon": "<svg viewBox=\"0 0 36 36\" fill=\"none\" stroke=\"currentColor\" stroke-width=\"1.5\"><path d=\"M18 4c-4 6-8 8-8 14a8 8 0 0016 0c0-6-4-8-8-14z\"/><path d=\"M14 22c0 2.2 1.8 4 4 4s4-1.8 4-4\"/></svg>"
    },
    {
      "id": "demon_hunter",
      "name": "Demon Hunter",
      "role": "Specialist Killer",
      "hook": "+50% damage vs demons. Vengeance stacks from fallen allies then unleashes devastating burst.",
      "armorType": "Light Armor · Crossbow / Dagger",
      "primaryAttr": "DEX",
      "armorTier": "light",
      "weapons": [
        "crossbow",
        "dagger"
      ],
      "startingEquipment": [
        "dagger",
        "dagger",
        "light_chest",
        "light_boots"
      ],
      "skills": [
        "demon_bolt",
        "glaive_toss",
        "fel_sight",
        "vengeance"
      ],
      "svgIcon": "<svg viewBox=\"0 0 36 36\" fill=\"none\" stroke=\"currentColor\" stroke-width=\"1.5\"><path d=\"M6 30L18 6l12 24\"/><path d=\"M11 22h14\"/><path d=\"M18 6v5\"/></svg>"
    },
    {
      "id": "scavenger",
      "name": "Scavenger",
      "role": "Resource Specialist",
      "hook": "Lucky Strike inflicts random statuses. Big Score is a high-variance gambling strike — crit huge or whiff.",
      "armorType": "Light/Medium · Any 1H weapon",
      "primaryAttr": "DEX",
      "armorTier": "light",
      "weapons": [
        "dagger",
        "sword",
        "hammer",
        "javelin"
      ],
      "startingEquipment": [
        "quarterstaff",
        "light_chest",
        "light_gauntlets"
      ],
      "skills": [
        "scrounge",
        "thrown_junk",
        "makeshift_bomb",
        "jackpot"
      ],